{
  "name": "hosted-opencode-v1",
  "kind": "hosted",
  "description": "B-hosted smoke：本机 OpenCode 子进程；缺密钥时验证归因树可输出 CONTEXT。",
  "model_driver": "live",
  "network": true,
  "secrets": ["env-only"],
  "durable_log": "temp-workspace",
  "attribution_tree": "attribution-tree-v1",
  "host": {
    "name": "opencode",
    "version": "1.18.5",
    "command": "opencode",
    "model": "meituan/LongCat-2.0"
  }
}
